user,text,refined
KhuranaSanya,"b'RT @LeanInOrg: Rangers lead the way! The Army is officially opening Ranger School to all qualified soldiers, regardless of gender. http://t\xe2\x80\xa6'",ranger lead way the armi offici open ranger school qualifi soldier regardless gender
KhuranaSanya,"b'RT @leaninigdtuw: Half of the problem is solved when you are aware, when you start acknowledging the issues regarding women in... http://t.\xe2\x80\xa6'",half problem solv awar start acknowledg issu regard woman
KhuranaSanya,"b'RT @leaninigdtuw: ""Every day, I want to get more comfortable with being uncomfortable.""\n\n~Nancy Saini\nTechnical Head... http://t.co/IBO3b6r\xe2\x80\xa6'",everi day I want get comfort uncomfort saini technic head
KhuranaSanya,b'Getting out of my comfort zone and leaning in to change - almost every moment - very slowly @melrobbins @LeanInOrg @leaninigdtuw',get comfort zone lean chang almost everi moment slowli
KhuranaSanya,"b'RT @melrobbins: ""The most difficult thing is the decision to act. The rest is merely tenacity"" #5SecondRule https://t.co/DgU7n07cND'",the difficult thing decis act the rest mere tenac
KhuranaSanya,"b'RT @girlsleadership: Unlike so many books out there that shame parents into compliance, Jessica Lahey writes with humor and compassion... h\xe2\x80\xa6'",unlik mani book shame parent complianc jessica lahey write humor compass h…
KhuranaSanya,b'RT @leaninigdtuw: Rescuing girls from failure makes them lose motivation \xe2\x80\x94 even more than boys. http://t.co/MKSVXRZx9b @RachelJSimmons',rescu girl failur make lose motiv even boy
KhuranaSanya,"b""RT @AnitaBorg_India: It's still tech talk at #TFG2015 New Delhi http://t.co/jUmNQPHNzH""",it still tech talk tfg2015 new delhi
KhuranaSanya,b'RT @AnitaBorg_India: Eman Hussein is a Grace Hopper Celebration champ #GHCI15 http://t.co/2FdktMhUBP',eman hussein grace hopper celebr champ ghci15
KhuranaSanya,"b""RT @leaninigdtuw: Lean In at IGDTUW's orientation successfully conducted. Here are some glimpses! @LeanInOrg http://t.co/IxSx0Rpz7I""",lean In igdtuw orient success conduct here glimps
KhuranaSanya,b'RT @leaninigdtuw: Leaders and The Council. Orientation Day. http://t.co/8VKLCOprUm',leader the council orient day
KhuranaSanya,b'RT @leaninigdtuw: For the 1000 likes on Facebook! \nHonored. http://t.co/g9mjmZWFa6',for like facebook honor
KhuranaSanya,"b""RT @leaninigdtuw: For people who think girls are 'too sissy'. Check our Vice-President, @rashmeet279 , Mechanical Engineer, Fourth Year htt\xe2\x80\xa6""",for peopl think girl sissi check vicepresid mechan engin fourth year htt…
KhuranaSanya,"b'RT @leaninigdtuw: ""Stage gave me shivers""\n@nancysaini3 look at where she is standing now. http://t.co/4kIZccmEQF'",stage gave shiver look stand
KhuranaSanya,b'RT @leaninigdtuw: How little things make a difference. \n@amo_ag13 http://t.co/aW7z0sOiJF',how littl thing make differ
KhuranaSanya,"b'RT @leaninigdtuw: ""I love coding. I am not great at it, but I become better everyday""\n@priya_bansal_19 http://t.co/uI7sztmUEu'",I love code I great I becom better everyday
KhuranaSanya,b'RT @leaninigdtuw: The year long plan explained by @PragyaSarda http://t.co/nCyNmdlHrx',the year long plan explain
KhuranaSanya,b'RT @leaninigdtuw: The plan of Action as explained by @apurvachawla1 \nLike a boss! http://t.co/lbzmKW52b2',the plan action explain like bos
KhuranaSanya,"b""RT @leaninigdtuw: People who think they can't rise above all odds. @KhuranaSanya proves you wrong by being an example. http://t.co/exj0LG1t\xe2\x80\xa6""",peopl think cant rise odd prove wrong exampl
KhuranaSanya,b'I am out of words right now !!!  I am shivering with excitement and crying with happiness &lt;3 &lt;3 I owe a lot to... http://t.co/mtcB6qdE2c',I word right I shiver excit cri happi lt3 lt3 I owe lot
KhuranaSanya,b'#LeanIn Freshmen Orientation at IGDTUW :) :) http://t.co/RvLo4v0fW5',leanin freshman orient igdtuw
KhuranaSanya,"b'RT @leaninigdtuw: ""I learnt that leaning in is a continuous process. You have to constantly remind yourself to sit at the table.""\nhttp://t.\xe2\x80\xa6'",I learnt lean continu process you constantli remind sit tabl
KhuranaSanya,"b""RT @leaninigdtuw: I am being the part of a revolution that cheers the girls &amp; women who want to sit at the table, that's why I Lean IN.\nhtt\xe2\x80\xa6""",I part revolut cheer girl amp woman want sit tabl that I lean IN htt…
KhuranaSanya,b'#leaninigdtuw http://t.co/GUuwYRtNxH',leaninigdtuw
KhuranaSanya,b'http://t.co/I4PGu3g7Ln',
KhuranaSanya,b'Leaning in .... !! #LeanIn http://t.co/qgJAhhGnTx',lean leanin
KhuranaSanya,"b'RT @rakeshmissra: @KhuranaSanya // In line with your ""Lean In"" initiative vis-a-vis women empowerment.'",In line lean In initi visavi woman empower
KhuranaSanya,b'Happy Birthday India \xe2\x9d\xa4\xef\xb8\x8f\xe2\x9d\xa4\xef\xb8\x8f',happi birthday india
KhuranaSanya,b'http://t.co/m8GAh3B0gW',
KhuranaSanya,b'With http://t.co/hzgIyxzBAK and Fbstart team http://t.co/7Ak9YBHVro',with fbstart team
KhuranaSanya,b'FbStart #Parse #FacebookAPIs #internet.org http://t.co/7fE4oJPyTb',fbstart par facebookapi internetorg
KhuranaSanya,b'http://t.co/sFhH93PLky',
KhuranaSanya,b'Though I am not an Engineer .. Still #ILookLikeAnEngineer \n#LeaningIn http://t.co/v8frhrumSt',though I engin still ilooklikeanengin leaningin
KhuranaSanya,b'RT @priya_bansal_19: Eagerly waiting for first lean in friday at our college. \n@leaninigdtuw \n#leaninfriday\n\n#taarangana :p',eagerli wait first lean friday colleg leaninfriday taarangana p
KhuranaSanya,"b'RT @leaninigdtuw: Leader No: 5\nShivangi Adlakha, 22, is pursuing Masters in Computer Applications. http://t.co/FfuxM9sUok'",leader No shivangi adlakha pursu master comput applic
KhuranaSanya,"b'RT @leaninigdtuw: Sitting at the Table.\nhttp://t.co/gRKg4Wz0gn\n""I learnt that leaning in is a continuous process.""\n@KhuranaSanya @LeanInOrg'",sit tabl I learnt lean continu process
KhuranaSanya,"b'RT @leaninigdtuw: Leader No: 6\nRachayita Giri, 19, is pursuing Bachelors of Technology in Information Technology.\n@rachayita_giri http://t.\xe2\x80\xa6'",leader No rachayita giri pursu bachelor technolog inform technolog
KhuranaSanya,"b'RT @leaninigdtuw: Leader No: 7\nPalak Chadha, 19, is pursuing Bachelors of Technology in Computer Science. http://t.co/kbQPIwSk6B'",leader No palak chadha pursu bachelor technolog comput scienc
KhuranaSanya,"b'RT @leaninigdtuw: Leader No: 8\nJhilmil Anurag, 20, is pursuing Bachelors of Technology in Electronics and Communication. http://t.co/dKIBXh\xe2\x80\xa6'",leader No jhilmil anurag pursu bachelor technolog electron commun
KhuranaSanya,b'RT @lean_in_dc: Even if #ILookLikeAnEngineer I still make $4000 less than men in my field. #equalpay nytimes http://t.co/c9UszDGyIQ http://\xe2\x80\xa6',even ilooklikeanengin I still make le men field equalpay nytim
KhuranaSanya,"b'RT @leaninigdtuw: Leader No: 1\nDiksha Singh, 19, is pursuing Bachelors of Technology in Electronics and Communication. http://t.co/km3aYSD9\xe2\x80\xa6'",leader No diksha singh pursu bachelor technolog electron commun
KhuranaSanya,"b'RT @leaninigdtuw: Leader No: 2\nPooja Goel, 19, is pursuing Bachelors of Technology in Electronics and Communication. http://t.co/1t4mNpFO6u'",leader No pooja goel pursu bachelor technolog electron commun
KhuranaSanya,"b'RT @leaninigdtuw: Leader No: 3\nSagarika Nangia, 19, is pursuing Bachelors of Technology in Electronics and Communication. http://t.co/Mw9Sd\xe2\x80\xa6'",leader No sagarika nangia pursu bachelor technolog electron commun
KhuranaSanya,"b'RT @leaninigdtuw: Leader No: 4\nMegha Bagri, 19, is pursuing Bachelors of Technology in Information Technology. http://t.co/EYyJ5Mize3'",leader No megha bagri pursu bachelor technolog inform technolog
KhuranaSanya,b'I love me and I believe in me.... \nsanya@monica.in http://t.co/heBhS03pfH',I love I believ sanya
KhuranaSanya,"b'As a school girl I was ambitious, innocent, above average in studies and talented... but my school friends said I... http://t.co/hKpfpEQ5kI'",As school girl I ambiti innoc averag studi talent school friend said I
KhuranaSanya,"b""About 4-in-10 Americans say there's a double-standard for judging men and women for top jobs http://t.co/pO9vHmsBEv""",about american say there doublestandard judg men woman top job
KhuranaSanya,"b'""India has had the longest stretches with a woman in power, with Indira Gandhi and Pratibha Patil"" still long way2go https://t.co/V3aNj9VNoW'",india longest stretch woman power indira gandhi pratibha patil still long way2go
KhuranaSanya,b'RT @clouddelhi: A thank you token to our bluemix technical experts by USIT @bikramnehra @Ec08Karan @irfanBshah @aprasahney http://t.co/IJrG\xe2\x80\xa6',A thank token bluemix technic expert usit
KhuranaSanya,b'RT @clouddelhi: SoftLayer Architecture in detail @IBMBluemix @irfanBshah @KhuranaSanya @aprasahney @bikramnehra @Ec08Karan http://t.co/3nBx\xe2\x80\xa6',softlay architectur detail
KhuranaSanya,b'RT @clouddelhi: Personal insights application on bluemix @irfanBshah @IBMBluemix  @KhuranaSanya @aprasahney @bikramnehra @Ec08Karan http://\xe2\x80\xa6',person insight applic bluemix
KhuranaSanya,b'RT @clouddelhi: Cheers to USIT coordinators and IBM Cloud ecosystem  @irfanBshah @aprasahney @bikramnehra @Ec08Karan @KhuranaSanya http://t\xe2\x80\xa6',cheer usit coordin ibm cloud ecosystem
KhuranaSanya,b'RT @clouddelhi: Hands on demo by @Ec08Karan at USIT @IBMBluemix @irfanBshah @KhuranaSanya @aprasahney @bikramnehra http://t.co/GKJMfXULnB',hand demo usit
KhuranaSanya,b'RT @clouddelhi: Hands on demo by @bikramnehra at USIT @IBMBluemix @aprasahney @KhuranaSanya @irfanBshah @Ec08Karan http://t.co/uZoH9VGyvu',hand demo usit
KhuranaSanya,b'RT @clouddelhi: Introduction to Bluemix and Bluemix catalog at USIT  @irfanBshah @IBMBluemix @KhuranaSanya @aprasahney http://t.co/EJ4x9wQq\xe2\x80\xa6',introduct bluemix bluemix catalog usit
KhuranaSanya,b'RT @clouddelhi: Setting up Bluemix in USIT - hands on session @irfanBshah @bikramnehra @aprasahney @KhuranaSanya @IBMBluemix http://t.co/OA\xe2\x80\xa6',set bluemix usit hand session
KhuranaSanya,b'RT @clouddelhi: The traditional way of developing apps @irfanBshah @IBMBluemix @KhuranaSanya @aprasahney @bikramnehra @Ec08Karan http://t.c\xe2\x80\xa6',the tradit way develop app
KhuranaSanya,b'RT @clouddelhi: Create application using Cloud Foundry \n@irfanBshah @IBMBluemix @KhuranaSanya @aprasahney @bikramnehra @Ec08Karan http://t.\xe2\x80\xa6',creat applic use cloud foundri
KhuranaSanya,b'RT @clouddelhi: Manifest.yml file #CloudFoundry @irfanBshah @IBMBluemix @KhuranaSanya @aprasahney @bikramnehra @Ec08Karan http://t.co/cfNni\xe2\x80\xa6',manifestyml file cloudfoundri
KhuranaSanya,b'RT @clouddelhi: Register on Bluemix for Hands-on tomorrow http://t.co/oAIEvEuQEq @irfanBshah @KhuranaSanya @aprasahney @IBMBluemix http://t\xe2\x80\xa6',regist bluemix handson tomorrow
KhuranaSanya,b'RT @clouddelhi: Cloud Computing workshop at USIT starts ... Day 1 @irfanBshah @IBMBluemix @KhuranaSanya @aprasahney #Bluemix http://t.co/M4\xe2\x80\xa6',cloud comput workshop usit start day bluemix
KhuranaSanya,b'Participants excited about Bluemix @clouddelhi  @aprasahney @irfanBshah @aparajitas403 http://t.co/fEliwO2yCT',particip excit bluemix
KhuranaSanya,b'Introduction to Cloud at Nodejs Meetup @clouddelhi @aprasahney @irfanBshah @aparajitas403 http://t.co/p6fsDCc0vp',introduct cloud nodej meetup
KhuranaSanya,b'Panel discussion @IBMcloud @clouddelhi @aprasahney @irfanBshah @metalwihen http://t.co/bRuw7DLVxN',panel discus
KhuranaSanya,b'Celebrity Match @clouddelhi @IBMcloud  @aprasahney @irfanBshah @metalwihen http://t.co/sW8SUtiXCy',celebr match
KhuranaSanya,b'Demo application EventQnA @clouddelhi @IBMcloud @aprasahney @irfanBshah http://t.co/6V90K91Rps',demo applic eventqna
KhuranaSanya,b'Hands on Demo on Bluemix @clouddelhi @IBMcloud @irfanBshah @aprasahney @metalwihen http://t.co/hqIbRGLF1Y',hand demo bluemix
KhuranaSanya,b'IBM mobility meetup at amity @clouddelhi @irfanBshah @aprasahney @metalwihen http://t.co/laKc8A15rD',ibm mobil meetup amiti
KhuranaSanya,b'I actually have very few real friends ..... http://t.co/Y4z3XC2YWB',I actual real friend
KhuranaSanya,b'If men were treated like women in the Workplace ... .. Phew !! #leanin http://t.co/hHHgSesLh7',If men treat like woman workplac phew leanin
KhuranaSanya,b'RT @rakeshmissra: An event impressively conducted by @metalwihen and @KhuranaSanya! https://t.co/Mf9vTefI9b',An event impress conduct
KhuranaSanya,b'IBM bluemix catalog and MobileFirst Platform @metalwihen @IBMcloud @aprasahney @irfanBshah @clouddelhi http://t.co/1fESCaGUat',ibm bluemix catalog mobilefirst platform
KhuranaSanya,b'RT @bikramnehra: @IBMBluemix event at #SRMUniversity @clouddelhi @irfanBshah @aprasahney @metalwihen @KhuranaSanya',event srmunivers
KhuranaSanya,b'RT @metalwihen: #clouddelhi @clouddelhi @irfanBshah @aprasahney @KhuranaSanya Open Discussion: Due Diligence &amp; Valuation with Experts http:\xe2\x80\xa6',clouddelhi due dilig amp valuat expert
KhuranaSanya,b'RT @metalwihen: #clouddelhi @clouddelhi @irfanBshah @aprasahney Due Diligence &amp; Valuation with Experts @KhuranaSanya http://t.co/IWJ772HouV',clouddelhi due dilig amp valuat expert
KhuranaSanya,b'@clouddelhi @irfanshah7 @aprasahney @IBMBluemix @metalwihen due diligence and valuation at amity http://t.co/ZnCKmFR5d3',due dilig valuat amiti
KhuranaSanya,b'RT @clouddelhi: Appy you rock Buddy !!  https://t.co/23BEXd4iP7',appi rock buddi
KhuranaSanya,b'@clouddelhi @IBMBluemix #iot networking after the event !! http://t.co/vv4lTLB9yn',iot network event
KhuranaSanya,b'@clouddelhi @IBMBluemix QnA with Surbhi http://t.co/ynLinUaesi',qna surbhi
KhuranaSanya,b'@clouddelhi @IBMBluemix #IoT #tweetingtree @adityaom1993 http://t.co/fBOeoBJBvS',iot tweetingtre
KhuranaSanya,b'@clouddelhi @IBMBluemix #iot enthusiastic crowd .... !! http://t.co/xCTweOQP2c',iot enthusiast crowd
KhuranaSanya,b'@clouddelhi @aprasahney @adityaom1993 #bluemix @SensitiveSensor Iot event at IBM http://t.co/TL4ioQoG89',bluemix iot event ibm
KhuranaSanya,b'@clouddelhi @IBMcloud @aprasahney @WomenWhoCode @IIITDelhi @EsyaIIITD  https://t.co/Gdbp4xxqvv',
KhuranaSanya,"b'RT @LeanInOrg: A victory for women, the Internet and maybe robots (all courtesy of this 9-year-old): http://t.co/586lGtn5WG #leanin http://\xe2\x80\xa6'",A victori woman internet mayb robot courtesi leanin
KhuranaSanya,b'RT @leaninigdtuw: The results for the recruitment drive held for over a month are out. \nWe welcome our new circle members.  @LeanInOrg http\xe2\x80\xa6',the result recruit drive held month We welcom new circl member
KhuranaSanya,"b'RT @SlideShare: How to be a better leader at work, via @vkoolcom: http://t.co/EdQWZgq06j #leadershipadvice http://t.co/CGkQ6KMvR5'",how better leader work via leadershipadvic
KhuranaSanya,b'@clouddelhi #bluemix #clouddelhi http://t.co/oiNIAzo3Is',bluemix clouddelhi
KhuranaSanya,b'RT @aprasahney: @irfanBshah @AngelHack @clouddelhi @iyernil @IBMBluemix @karthik_padman http://t.co/O3eKyIse3U',
KhuranaSanya,b'RT @irfanBshah: Luvin da energy @AngelHack #Delhi  @clouddelhi @iyernil @IBMBluemix #bluemix @aprasahney  @karthik_padman #clouddelhi http:\xe2\x80\xa6',luvin da energi delhi bluemix clouddelhi
KhuranaSanya,b'#Bluemix #iot @clouddelhi http://t.co/ctvn5uRuaY',bluemix iot
KhuranaSanya,"b""Smartest 7th grader I've ever met #bluemix #iot @clouddelhi http://t.co/g0N5Qy5VAn""",smartest grader ive ever met bluemix iot
KhuranaSanya,b'#bluemix #iot @clouddelhi http://t.co/lSAayoEsWk',bluemix iot
KhuranaSanya,b'#PaaS #bluemix #clouddelhi #iot @amity_incubatr @clouddelhi @bikramnehra http://t.co/GHVlVd7Tp5',paa bluemix clouddelhi iot
KhuranaSanya,b'RT @metalwihen: @irfanBshah @clouddelhi @aprasahney @bikramnehra The IBM Cloud Developer Bootcamp begins! http://t.co/UYtRiv54Qb',the ibm cloud develop bootcamp begin
KhuranaSanya,b'#bluemix #iot #clouddelhi @clouddelhi http://t.co/5SgoYnSqwx',bluemix iot clouddelhi
KhuranaSanya,b'##bluemix #iot #clouddelhi @clouddelhi @gvaibhavraj2 @metalwihen @aprasahney http://t.co/UQVbsFEhB0',bluemix iot clouddelhi
KhuranaSanya,"b""Amongst the many popular tourist attractions located here are Humayun's Tomb, Purana Qila and the Lodhi gardens and tombs. Connaught Place""",amongst mani popular tourist attract locat humayun tomb purana qila lodhi garden tomb connaught place
KhuranaSanya,b'Where is New Delhi ? #BluemixWatson',where new delhi bluemixwatson
KhuranaSanya,b'RT @irfanBshah: @amity_incubatr @AVOIND @aprasahney @clouddelhi @gvaibhavraj2 @rikscr7 @metalwihen #bluemix @KhuranaSanya #startups http://\xe2\x80\xa6',bluemix startup
KhuranaSanya,"b'RT @leaninigdtuw: Jishnu Gandhi, works for Google Inc. &amp; holds a http://t.co/W2Wx2aCW5G (hons) from SRCC.\n#LeanInTogether http://t.co/RTBH2\xe2\x80\xa6'",jishnu gandhi work googl inc amp hold hon srcc leanintogeth
KhuranaSanya,b'@LeanInOrg @leaninigdtuw @jishnugandhi #LeanInTogether  https://t.co/wXXAB8qHx0',leanintogeth
KhuranaSanya,"b'RT @LeanInOrg: \xe2\x80\x9cHalf the humans are girls and women, so we want half the engineers and scientists to be girls and women.\xe2\x80\x9d -#BillNye http://\xe2\x80\xa6'",half human girl woman want half engin scientist girl woman billny
KhuranaSanya,b'@clouddelhi #Bluemix #CloudDelhi http://t.co/mAkE0OfqjD',bluemix clouddelhi
KhuranaSanya,b'@clouddelhi @IBMcloud #CloudDelhi #Bluemix http://t.co/JLAjgnC5Sp',clouddelhi bluemix
KhuranaSanya,b'Everyone giving their intro #Bluemix #CloudDelhi @clouddelhi http://t.co/lMzq9g1Yjo',everyon give intro bluemix clouddelhi
KhuranaSanya,b'@gvaibhavraj2 @clouddelhi #Bluemix  #CloudDelhi http://t.co/33X8l9EWBn',bluemix clouddelhi
KhuranaSanya,b'#CloudDelhi #Bluemix http://t.co/zqbP2Tg4wy',clouddelhi bluemix
KhuranaSanya,b'#CloudDelhi #Bluemix http://t.co/T9YMtVNB1y',clouddelhi bluemix
KhuranaSanya,"b""RT @seemagoswami: Let's hear it for Indira Gandhi who #DespiteBeingAWoman helped liberate Bangladesh. And for Sheikh Hasina who #DespiteBei\xe2\x80\xa6""",let hear indira gandhi despitebeingawoman help liber bangladesh and sheikh hasina despitebei…
KhuranaSanya,"b'YouTube CEO, Yahoo CEO and Facebook COO #DespiteBeingAWoman http://t.co/trRlgBAUg7'",youtub ceo yahoo ceo facebook coo despitebeingawoman
KhuranaSanya,b'http://t.co/F8miZRRugH via @storypicker',via
KhuranaSanya,"b""We laugh about how girls are so mean to each other, like it's a given. Why? We can stop. #MeanGirls http://t.co/aXbV8Mwwus""",We laugh girl mean like given whi We stop meangirl
KhuranaSanya,b'@HillaryClinton If I were an American citizen I would have given my vote to her #LeanInHillaryClinton #SupportFromIndia @LeanInOrg',If I american citizen I would given vote leaninhillaryclinton supportfromindia
KhuranaSanya,b'RT @UN_Women: \xe2\x80\x9cThe feeling of fear is always inside a girl.\xe2\x80\x9d We have the power to change this. http://t.co/QL7IJjaUHi via @WEvolveGlobal',the feel fear alway insid girl We power chang via
KhuranaSanya,b'Another earthquake .... God have mercy on Nepal !!! \xf0\x9f\x99\x8f',anoth earthquak god merci nepal
KhuranaSanya,b'RT @amandajanerosso: You are amazing Mom - I hope one day my kids have the same relationship with me as I have with you. @DianeLohanRosso h\xe2\x80\xa6',you amaz mom I hope one day kid relationship I h…
KhuranaSanya,b'Sweet by face and strong by heart... She is the best mom of the world :) @LeanInOrg #LeanInTogether http://t.co/Te4FHWsGUH',sweet face strong heart she best mom world leanintogeth
KhuranaSanya,"b'Shared the science of ""power pose"" in the Lean In Meeting today  !! @amyjccuddy @LeanInOrg http://t.co/5rsmHBRKs5'",share scienc power pose lean In meet today
KhuranaSanya,b'RT @levoleague: Know your worth. See your value. The perfect inspiration to #ask4more! http://t.co/nx8xlLEGMN #equalpayday http://t.co/UfRW\xe2\x80\xa6',know worth see valu the perfect inspir ask4mor equalpayday
KhuranaSanya,b'RT @Prooffix: Prooffix is proud to support @KhuranaSanya on her #leanin application. Good luck!... http://t.co/Bc0MY4BrM9',prooffix proud support leanin applic good luck
KhuranaSanya,b'\xe2\x80\x9c@Prooffix: Prooffix is proud to support @KhuranaSanya on her #leanin application. Good luck! @leaninorg\xe2\x80\x9d thanks @Prooffix',prooffix proud support leanin applic good luck thank
KhuranaSanya,"b""RT @googlecloud: What's the first thing you created with code? Share your thoughts to inspire girls to be #FutureCoders @khanacademy http:/\xe2\x80\xa6""",what first thing creat code share thought inspir girl futurecod
KhuranaSanya,"b'""Theory of failing fast is an ideal paradigm for building female confidence"" - the confidence code @KattyKayBBC'",theori fail fast ideal paradigm build femal confid confid code
KhuranaSanya,b'RT @ariannahuff: Men for equality in the workplace @richardbranson http://t.co/GgM3gWkwTf #LeanInTogether',men equal workplac leanintogeth
KhuranaSanya,"b""#LeanInTogether .... \xf0\x9f\x98\x8a it's for men \xf0\x9f\x98\x8a\xf0\x9f\x98\x8a\xe2\x9c\x8c\xef\xb8\x8fhttp://t.co/BVaN4fZZd2""",leanintogeth men
KhuranaSanya,b'Something I tell my lean in girls everyday @LeanInOrg @sherylsandberg http://t.co/Po2SoccCwa',someth I tell lean girl everyday
KhuranaSanya,"b""The Importance of Being Yourself -- Even When It's Hard by @jackycarter #amandaseales #advice http://t.co/KSnvSDdh7F via @SlideShare""",the import be yourself even when it hard amandaseal advic via
KhuranaSanya,b'RT @WOBUK: The #AskHerMore campaign at the #Oscars sees leading actresses talking about more than just who they are wearing. http://t.co/ne\xe2\x80\xa6',the askhermor campaign oscar see lead actress talk wear
KhuranaSanya,b'RT @HuffingtonPost: Reese Witherspoon supports #AskHerMore on the #OscarsRedCarpet http://t.co/0VswC70027 http://t.co/qBukJPx8eI',rees witherspoon support askhermor oscarsredcarpet
KhuranaSanya,"b'Lean In 2.0\nThe second week of Leaning in with the members had discussions on the book ""Poor Little Rich Slum""... http://t.co/GrqYZ4rmQH'",lean In the second week lean member discus book poor littl rich slum
KhuranaSanya,b'7 Things We Need to Stop Saying to Sexual Assault Survivors Immediately http://t.co/ptWiiILzT3',thing We need stop say sexual assault survivor immedi
KhuranaSanya,b'I just discovered Developing Android Apps @Udacity. Check it out here! https://t.co/407UlkbQuq',I discov develop android app check
KhuranaSanya,b'http://t.co/hI6X6CUSG9',
KhuranaSanya,b'RT @LeanInOrg: Computer scientist. Navy admiral. Queen of Code. @FiveThirtyEight explores the life and legacy of Grace Hopper: http://t.co/\xe2\x80\xa6',comput scientist navi admir queen code
KhuranaSanya,b'RT @LeanInOrg: Strength in Numbers: A New Community for Women in Computer Science. http://t.co/7ADgAtnTs8. Join us at http://t.co/C9V3EU3bS\xe2\x80\xa6',strength number A new commun woman comput scienc join u
KhuranaSanya,"b""RT @LeanInOrg: Happy Valentine's Day! Thanks to all the 50/50 partners out there. #leanin http://t.co/d7T32Mq4jh""",happi valentin day thank partner leanin
KhuranaSanya,b'Lean In 2.0\nThe first week of Leaning in with the members had discussions on varied topics and books that helped... http://t.co/7XbktOmB0h',lean In the first week lean member discus vari topic book help
KhuranaSanya,"b'Lean In 2.0\nLean In 2.0, IGDTUW will work on promoting and supporting the members to achieve more than they think... http://t.co/pt2jqE1dzA'",lean In lean In igdtuw work promot support member achiev think
KhuranaSanya,"b'Grace Hopper Celebration of Women in Computing .... ""The Queen of Code"" ....For all women in technology ..... http://t.co/Vnt9zPLB6C'",grace hopper celebr woman comput the queen code for woman technolog
KhuranaSanya,b'The Queen of Code #gracehoppercelebration #leanin http://t.co/7szCZQbdEK',the queen code gracehoppercelebr leanin
KhuranaSanya,"b""Facebook's Sandberg: Women engineers should Lean In http://t.co/ls3UBBLjhS""",facebook sandberg woman engin lean In
KhuranaSanya,"b'To Get Women Into Computer Science, Sheryl Sandberg Launches Lean In Mentorship Network http://t.co/HfKRtARK45'",To get woman into comput scienc sheryl sandberg launch lean In mentorship network
KhuranaSanya,b'Sheryl Sandberg and Adam Grant on Women Doing \xe2\x80\x98Office Housework\xe2\x80\x99 http://t.co/HQPlU6V6JC',sheryl sandberg adam grant woman do offic housework
KhuranaSanya,b'What (Some) Silicon Valley Women Think Of Newsweek http://t.co/DjyJAmfgiM',what some silicon valley woman think Of newsweek
KhuranaSanya,b'RT @osgOlivia: Nora is speaking at @cisco_woi ! MT@Jo_Miller: 11 reasons why you should follow Nora Denzel (@ndenzel) on Twitter http://t.c\xe2\x80\xa6',nora speak reason follow nora denzel twitter
KhuranaSanya,b'Imposter Syndrome....\nhttps://t.co/ZNAEEDuKOl http://t.co/GKOZG7TUks',impost syndrom
KhuranaSanya,b'I posted a new photo to Facebook http://t.co/TcsOUC11Dp',I post new photo facebook
KhuranaSanya,b'Very well explained the hypocrisy of Indian society !!... http://t.co/39mcHMdhdp',veri well explain hypocrisi indian societi
KhuranaSanya,"b'Lean In @ IGDTUW Circle answers ""What would you do if you weren\'t afraid ?? "" And here are some of the responses... http://t.co/4zMP2KBuDg'",lean In igdtuw circl answer what would werent afraid and respons
KhuranaSanya,"b'Lean In @ IGDTUW Circle answers ""What would you do if you weren\'t afraid ?? "" And here are some of the responses... http://t.co/h0T39BAUyN'",lean In igdtuw circl answer what would werent afraid and respons
KhuranaSanya,"b'Lean In @ IGDTUW Circle answers ""What would you do if you weren\'t afraid ?? "" And here are some of the responses... http://t.co/TWXDYtZams'",lean In igdtuw circl answer what would werent afraid and respons
