user,text,refined
KhuranaSanya,"b'Lean In @ IGDTUW Circle answers ""What would you do if you weren\'t afraid ?? "" And here are some of the responses... http://t.co/qyHbfpP0Wl'",lean In igdtuw circl answer what would werent afraid and respons
KhuranaSanya,"b'Lean In @ IGDTUW Circle answers ""What would you do if you weren\'t afraid ?? "" And here are some of the responses... http://t.co/JuMRPogiWx'",lean In igdtuw circl answer what would werent afraid and respons
KhuranaSanya,"b'Lean In @ IGDTUW Circle answers ""What would you do if you weren\'t afraid ?? "" And here are some of the responses... http://t.co/0KdXdGri3i'",lean In igdtuw circl answer what would werent afraid and respons
KhuranaSanya,"b'Lean In @ IGDTUW Circle answers ""What would you do if you weren\'t afraid ?? "" And here are some of the responses... http://t.co/Y97fZ0FFnq'",lean In igdtuw circl answer what would werent afraid and respons
KhuranaSanya,"b'Lean In @ IGDTUW Circle answers ""What would you do if you weren\'t afraid ?? "" And here are some of the responses... http://t.co/lwIuBTHPIK'",lean In igdtuw circl answer what would werent afraid and respons
KhuranaSanya,"b'Lean In @ IGDTUW Circle answers ""What would you do if you weren\'t afraid ?? "" And here are some of the responses... http://t.co/xSqXO7KPYx'",lean In igdtuw circl answer what would werent afraid and respons
KhuranaSanya,"b'Lean In @ IGDTUW Circle answers ""What would you do if you weren\'t afraid ?? "" And here are some of the responses... http://t.co/WahKoq4TwQ'",lean In igdtuw circl answer what would werent afraid and respons
KhuranaSanya,"b'Lean In @ IGDTUW Circle answers ""What would you do if you weren\'t afraid ?? "" And here are some of the responses... http://t.co/NLoZvbwZ17'",lean In igdtuw circl answer what would werent afraid and respons
KhuranaSanya,b'http://t.co/PRzXywlTx0',
KhuranaSanya,b'I posted a new photo to Facebook http://t.co/Gadv3CiUAW',I post new photo facebook
KhuranaSanya,b'14 bizarre reasons why Indians think women get raped! http://t.co/fy2V6f5au5',bizarr reason indian think woman get rape
KhuranaSanya,"b'\xe2\x80\x9cThe cost of stability is often diminished opportunities for growth\xe2\x80\x9d \n\xe2\x80\x95 Sheryl Sandberg, Lean In: Women, Work, and the Will to Lead'",the cost stabil often diminish opportun growth sheryl sandberg lean In woman work will lead
KhuranaSanya,b'http://t.co/3R6gs5zy1c',
KhuranaSanya,b'Circles 2.0 | Lean In Circles http://t.co/BSLV2Qtfw0',circl lean In circl
KhuranaSanya,b'University of Cape Town Leans In http://t.co/fyU6328G2W',univers cape town lean In
KhuranaSanya,b'http://t.co/rgaUZdcTo4',
KhuranaSanya,b'http://t.co/RjULhsFmS2',
KhuranaSanya,b'This pic sums up my 2014 :) @LeanInOrg http://t.co/zZwxwK0s49',thi pic sum
KhuranaSanya,"b""New Year's Resolution? Get a Little Help From Your Friends http://t.co/YSH2TYRQxa""",new year resolut get littl help from your friend
KhuranaSanya,b'http://t.co/G5QzsqnBnH',
KhuranaSanya,b'http://t.co/PUpov9pvJf',
KhuranaSanya,b'http://t.co/nCepuk3y2Y',
KhuranaSanya,b'Instead of resolutions this year ... Set your dreams with deadlines http://t.co/OxBAUjADao',instead resolut year set dream deadlin
KhuranaSanya,"b'RT @InternSherry: Instead of resolutions this year, set dreams with deadlines @BeLeaderly #leadership #NewYearsResolution http://t.co/YmoCb\xe2\x80\xa6'",instead resolut year set dream deadlin leadership newyearsresolut
KhuranaSanya,b'Dear lovely lean in ladies !!! \n\nSince we will not be able to meet this month because of winter vacations!! I was... http://t.co/VPN9FEeMWE',dear love lean ladi sinc abl meet month winter vacat I
KhuranaSanya,b'Sheryl Sandberg\xe2\x80\x99s \xe2\x80\x98Lean In\xe2\x80\x99 http://t.co/ttvwW3EAmk',sheryl sandberg lean In
KhuranaSanya,"b""What would you do if you weren't afraid ?\n\nhttp://t.co/IPZ9mu5emL http://t.co/Hu8alhOUX8""",what would werent afraid
KhuranaSanya,"b""18 Badass Women You Probably Didn't Hear About In 2014 http://t.co/EjxohRkObQ""",badass woman you probabl didnt hear about In
KhuranaSanya,b'Women at Work: A Guide for Men http://t.co/WAs4vNo8vS',woman work A guid men
KhuranaSanya,b'RT @BeLeaderly: 11 leadership lessons learned by @katefcondev. Do you have one that is not on the list?  http://t.co/DuLR6hGNKx http://t.co\xe2\x80\xa6',leadership lesson learn Do one list
KhuranaSanya,b'#HerLifeHerChoices\nhttps://t.co/Za72IJQb4G http://t.co/Tl2Zt3ruLG',herlifeherchoic
KhuranaSanya,b'Sheryl sandberg on importance of computer science ... #HourofCode http://t.co/44l4UgNQy3',sheryl sandberg import comput scienc hourofcod
KhuranaSanya,b'http://t.co/PYANO1ZWX1',
KhuranaSanya,"b""RT @LeanInOrg: Check out the first of Sheryl Sandberg and Adam Grant's op-eds on Women and Work for The New York Times: http://t.co/uSfUJcW\xe2\x80\xa6""",check first sheryl sandberg adam grant op woman work the new york time
KhuranaSanya,"b""RT @HuffingtonPost: You probably won't lose weight without doing this first http://t.co/xtFAiYaKi2""",you probabl wont lose weight without first
KhuranaSanya,"b""Women frm @ariannahuff to @rachelsklar on how to overcme what's holding women back  http://t.co/Eyqh8dLMSg by @vivian_giang via @FastCompany""",woman frm overcm what hold woman back via
KhuranaSanya,"b'RT @BeLeaderly: If you don\xe2\x80\x99t have a seat at the table, bring your own chair. http://t.co/eXG4wn9sf1  #LeadershipQuotes http://t.co/8JFM9MzJ\xe2\x80\xa6'",If seat tabl bring chair leadershipquot
KhuranaSanya,"b""RT @sophiemayhook: Want to redefine the way you are perceived at work? @Jo_Miller's @BeLeaderly article tells you how...http://t.co/FDhtp7m\xe2\x80\xa6""",want redefin way perceiv work articl tell
KhuranaSanya,b'2nd Lean In meeting ... First step towards our ambitions (y) http://t.co/bqzxd4FjAb',lean In meet first step toward ambit
KhuranaSanya,"b'"" done is better than perfect "" http://t.co/TAEQ7coFMz'",done better perfect
KhuranaSanya,b'2nd lean in meeting .. First step towards our ambitions @LeanInOrg http://t.co/04VimCW7EQ',lean meet first step toward ambit
KhuranaSanya,b'2nd lean in meeting.... First step towards our ambitions!! #leaninorg #leanincampus http://t.co/BdUBKA3d7H',lean meet first step toward ambit leaninorg leanincampu
KhuranaSanya,b'http://t.co/Rt3yzHy9Si',
KhuranaSanya,b'The end of this hilarious video nails it \n\nMust watch ;)\n\nhttp://t.co/nCBDrxbZrd http://t.co/66ndWBzaFR',the end hilari video nail must watch
KhuranaSanya,"b""RT @BeLeaderly: Don't like how you're perceived at work? Redefine your personal brand in 3 steps.  http://t.co/iFDsRWskfd http://t.co/h1Sdz\xe2\x80\xa6""",dont like your perceiv work redefin person brand step
KhuranaSanya,"b'RT @LeanInOrg: ""The more you celebrate your life, the more in life there is to celebrate."" -Oprah Winfrey http://t.co/ouM9lGfkYe'",the celebr life life celebr oprah winfrey
KhuranaSanya,"b""RT @LeanInOrg: Hour of Code releases a new game featuring Frozen's Anna and Elsa to get girls coding #LetItGo http://t.co/6nTuUBUpTZ""",hour code releas new game featur frozen anna elsa get girl code letitgo
KhuranaSanya,"b'RT @LeanInOrg: ""If you\'re offered a seat on a rocket ship, you don\'t ask what seat. You just get on."" -Lean In http://t.co/lHV2FTHfSx'",If your offer seat rocket ship dont ask seat you get lean In
KhuranaSanya,b'http://t.co/lVXc4WV4w1',
KhuranaSanya,b'And we thought google is the best search engine .... @WolframResearch',and thought googl best search engin
KhuranaSanya,b'For all the Girls in Tech out there... This is a MUST READ !!!!! http://t.co/mkpNf1w40e',for girl tech thi must read
KhuranaSanya,b'ARE YOU KIDDING ME !!!!?????\n\nhttp://t.co/qDzGrHBhyf http://t.co/4HORmO1Ghy',are you kid ME
KhuranaSanya,"b""\xe2\x80\x9cAnd in situations where a man and a woman each receive negative feedback, the woman's self-confidence and... http://t.co/bDcQFBvtjP""",and situat man woman receiv neg feedback woman selfconfid
KhuranaSanya,b'RT @shewrote: Motivation behind #Slush: How many students wants to start their own company? Before: 3 out of 600. This year: more than 50% \xe2\x80\xa6',motiv behind slush how mani student want start compani befor thi year
KhuranaSanya,b'RT @googleanalytics: iOS App Install Tracking Comes To Analytics: http://t.co/oyz5iLne80 [via @sarahintampa / @techcrunch] #ICYMI',io app instal track come To analyt via icymi
KhuranaSanya,b'Vigilant Eye on Gender Pay Gap http://t.co/4Dw9fsz17V',vigil eye gender pay gap
KhuranaSanya,b'http://t.co/mpl6sUn0U7',
KhuranaSanya,b'31 Candid Photos That Sum Up What Fatherhood Looks Like http://t.co/yIVJSrk0ze',candid photo that sum Up what fatherhood look like
KhuranaSanya,b'They Help Techie Women Lean In - The New Indian Express http://t.co/waAUkSViqb',they help techi woman lean In the new indian express
KhuranaSanya,b'http://t.co/V4yzKTfDtP',
KhuranaSanya,b'What if we raised girls to help them both master negotiation skills and navigate the challenges?  http://t.co/SFiIZTc05w by @gwenmoran',what rais girl help master negoti skill navig challeng
KhuranaSanya,b'http://t.co/lF5ERc4BB5',
KhuranaSanya,"b""Sheryl Sandberg Book 'Lean In': Facebook COO on How Women 'Sabotage' Their Careers http://t.co/jdibtXOK40""",sheryl sandberg book lean In facebook coo how woman sabotag their career
KhuranaSanya,b'RT @womensleadershp: 4 ways to quickly build #influence in a new job  http://t.co/WgXaaPS6Uw',way quickli build influenc new job
KhuranaSanya,b'I posted a new photo to Facebook http://t.co/95uwJC3lP0',I post new photo facebook
KhuranaSanya,b'I posted a new photo to Facebook http://t.co/PD9MRHoC9g',I post new photo facebook
KhuranaSanya,b'@LeanInOrg http://t.co/gnuotGAdJM',
KhuranaSanya,b'Thank you mom and dad for putting an ambitious spark in me . And thank you @LeanInOrg for igniting it :) :)',thank mom dad put ambiti spark and thank
KhuranaSanya,b'http://t.co/luqVdLoRuK',
KhuranaSanya,"b'""we compromise our career goals to make room for partners and children who may not even exist yet"" - Sheryl... http://t.co/FdT0Jwvlpb'",compromis career goal make room partner child may even exist yet sheryl
KhuranaSanya,b'http://t.co/KNGDLqMeFP http://t.co/MpOEvf4X4f',
KhuranaSanya,"b'We always teach our ""tough boys"" that boys don\'t cry ... Instead we should teach them not to make others cry !!... http://t.co/RVVUxUs7mz'",We alway teach tough boy boy dont cri instead teach make other cri
KhuranaSanya,b'http://t.co/iVM7srC9wv',
KhuranaSanya,b'http://t.co/NrqDetisk7',
KhuranaSanya,b'3 Ways To Become CEO Before You Turn 30 http://t.co/wDUQGuwV2x',way To becom ceo befor you turn
KhuranaSanya,b'Sheryl Sandberg\xe2\x80\x99s \xe2\x80\x98Lean In\xe2\x80\x99 http://t.co/l0wozcPloK',sheryl sandberg lean In
KhuranaSanya,"b'Benevolent sexism, a defining aspect of how masculinity is constructed in conservative cultures, is defined as... http://t.co/CZ5eIJhn4v'",benevol sexism defin aspect masculin construct conserv cultur defin
KhuranaSanya,"b'May The Divine And Spiritual Light.\nOf This Holy Festival,\nBrighten Up Your Life With Health And Joy.\nHappy Diwali :)'",may the divin and spiritu light Of thi holi festiv brighten Up your life with health and joy happi diwali
KhuranaSanya,"b'Respecting women is about respecting their choices, JNU student tells ABVP on live-in relationships http://t.co/GEKZyV8n0M'",respect woman respect choic jnu student tell abvp livein relationship
KhuranaSanya,"b""RT @Ok2BeFat: If you want to lose weight or not- you shouldn't feel like you have to in order to be treated like a human being. \nIt's ok to\xe2\x80\xa6""",If want lose weight not shouldnt feel like order treat like human it ok to…
KhuranaSanya,b'The Feminist Guide To Non-Creepy Flirting http://t.co/MaUqso7CMt',the feminist guid To noncreepi flirt
KhuranaSanya,b'The Feminist Guide To Non-Creepy Flirting http://t.co/2n9L178yXk via @EvrydayFeminism',the feminist guid To noncreepi flirt via
KhuranaSanya,b'I posted a new photo to Facebook http://t.co/wxFdfmGz1F',I post new photo facebook
KhuranaSanya,b'I posted a new photo to Facebook http://t.co/9xDnnYB3fr',I post new photo facebook
KhuranaSanya,b'How to Ask for a Raise http://t.co/qMBeKRpxwC',how ask rais
KhuranaSanya,"b'""It\xe2\x80\x99s important that we challenge ourselves and each other to become the best feminists we can be. It\xe2\x80\x99s not a... http://t.co/7wo0oHDQZL'",It import challeng becom best feminist It
KhuranaSanya,b'How to Grow Your Daily Practice as a Feminist http://t.co/HAt2kWl8OP via @evrydayfeminism',how grow your daili practic feminist via
KhuranaSanya,b'How to Grow Your Daily Practice as a Feminist http://t.co/PrLIEdvY28',how grow your daili practic feminist
KhuranaSanya,b'http://t.co/yV9wx6f12G http://t.co/yyndeAhWjL',
KhuranaSanya,b'Can we change the princess culture ?? \nUpworthy\nhttp://t.co/GpCrk8D06A http://t.co/20QdSp5TPZ',can chang princess cultur upworthi
KhuranaSanya,"b""Is the princess culture something we can change? Let's try. (via @Upworthy) http://t.co/Etq5Rg5ira""",Is princess cultur someth chang let tri via
KhuranaSanya,b'I posted a new photo to Facebook http://t.co/FnkDgXIkzw',I post new photo facebook
KhuranaSanya,b'Lean In Everyday Feminism http://t.co/4fxcBJei27',lean In everyday femin
KhuranaSanya,b'https://t.co/HAFujZOyK0 http://t.co/s2kLk3Krog',
KhuranaSanya,b'Thank you @amandajanerosso for sharing this.... @krohntraaseth talks about not listening to the haters  http://t.co/47hAkD5Iwr\n@LeanInOrg',thank share talk listen hater
KhuranaSanya,"b""leaninorg's photo http://t.co/lCjHks3MSA""",leaninorg photo
KhuranaSanya,b'@LeanInOrg @sherylsandberg http://t.co/SCfdAheovB',
KhuranaSanya,b'RT @BeLeaderly: Are you a rising woman of influence? Sign up for our newsletter to get leadership advice delivered to your inbox http://t.c\xe2\x80\xa6',are rise woman influenc sign newslett get leadership advic deliv inbox
KhuranaSanya,b'@satyamevjayate Drive cautiously.. you are never a experienced driver.its a new day #RoadsOKPlease #MumkinHai',drive cautious never experienc driverit new day roadsokpleas mumkinhai
KhuranaSanya,"b""@satyamevjayate it's very important to clip or lock the helmets. #RoadsOKPlease""",import clip lock helmet roadsokpleas
KhuranaSanya,"b'Seeing Other Women As Allies, Rather Than Enemies: A How-To http://t.co/xMRVuNWoSw via @EvrydayFeminism'",see other woman As alli rather than enemi A howto via
KhuranaSanya,b'Salute to their efforts in the education of women and against the exploitation of children respectively - The... http://t.co/KPyCbmrCpG',salut effort educ woman exploit child respect the
KhuranaSanya,"b""I'm #leaningin and just read 'Is Fear Your Only Restraint?' on @LeanInOrg http://t.co/6INn4pQ8cp""",Im leaningin read Is fear your onli restraint
KhuranaSanya,b'@LeanInOrg http://t.co/yuuEZsAl7G',
KhuranaSanya,b'http://t.co/pqDqo7JNvD',
KhuranaSanya,b'http://t.co/F67s2fs9Jc',
KhuranaSanya,"b'RT @LeanInOrg: Aziz Ansari Explains Why He Is Most Definitely A Feminist, via @BuzzFeed: http://t.co/ZBqsBunfXS'",aziz ansari explain whi He Is most definit A feminist via
KhuranaSanya,"b'RT @KMac800: #LikeAGirl ""@womensleadershp: Take the lead. (Like a boss!)""'",likeagirl take lead like bos
KhuranaSanya,b'http://t.co/Lk9kUjZH3r',
KhuranaSanya,"b""Meet The World's Youngest Female Billionaire, A College Dropout And Medical Genius http://t.co/DdMHjitrRZ""",meet the world youngest femal billionair A colleg dropout and medic geniu
KhuranaSanya,b'https://t.co/wcMgyRDzNZ http://t.co/ZLv3MvWJIQ',
KhuranaSanya,"b'Curvy Is the New Skinny, Thanks To Photoshop Phoniness http://t.co/VY9OW6f6N9'",curvi Is new skinni thank To photoshop phoni
KhuranaSanya,"b'RT @LeanInOrg: ""You\'re not \'bossy.\' You\'re not \'too ambitious.\' You are going to have an impact on the world."" #leanincircles'",your bossi your ambiti you go impact world leanincircl
KhuranaSanya,b'http://t.co/VaT9NjXuf1',
KhuranaSanya,"b""\xe2\x80\x9cThe reason I don't have a plan is because if I have a plan I'm limited to today's options\xe2\x80\x9d \n\xe2\x80\x95 Sheryl Sandberg""",the reason I dont plan I plan Im limit today option sheryl sandberg
KhuranaSanya,b'4 Simple Ways to Cast Out Impostors Syndrome http://t.co/gua2iCMMHT via @evrydayfeminism @leaninorg',simpl way cast out impostor syndrom via
KhuranaSanya,"b""RT @anrah: Why women leave tech: It's the culture, not because 'math is\xc2\xa0hard' via @FortuneMagazine http://t.co/bbeVvQfy0b""",whi woman leav tech it cultur math hard via
KhuranaSanya,b'RT @LeanInOrg: Things we &lt;3: the launch of Lean In Circles at the Indira Gandhi Delhi Technical University for Women! http://t.co/h8CCdwgrte',thing lt3 launch lean In circl indira gandhi delhi technic univers woman
